Loaded loader_megatron as the loader.
Loaded saver_megatron as the saver.
Starting saver...
Starting loader...
checkpoint path: /groups/gaf51275/llama/checkpoints/Llama-2-7b-base-extended-scaling/okazaki_lab_cc//tp2-pp2, iteration: 40000
Setting num_layers to 32 from checkpoint
Setting hidden_size to 4096 from checkpoint
Setting ffn_hidden_size to 11008 from checkpoint
Setting seq_length to 4096 from checkpoint
Setting num_attention_heads to 32 from checkpoint
Setting num_query_groups to 32 from checkpoint
Setting group_query_attention to True from checkpoint
Setting kv_channels to 128 from checkpoint
Setting max_position_embeddings to 4096 from checkpoint
Setting position_embedding_type to rope from checkpoint
Setting add_position_embedding to False from checkpoint
Setting use_rotary_position_embeddings to True from checkpoint
Setting rotary_percent to 1.0 from checkpoint
Setting add_bias_linear to False from checkpoint
Setting swiglu to True from checkpoint
Setting untie_embeddings_and_output_weights to True from checkpoint
Setting apply_layernorm_1p to False from checkpoint
Setting normalization to RMSNorm from checkpoint
Setting tokenizer_type to Llama2Tokenizer from checkpoint
Setting padded_vocab_size to 43176 from checkpoint
Setting tensor_model_parallel_size to 2 from checkpoint
Setting pipeline_model_parallel_size to 2 from checkpoint
Checkpoint did not provide arguments virtual_pipeline_model_parallel_size
Checkpoint did not provide arguments num_layers_per_virtual_pipeline_stage
using world size: 4, data-parallel-size: 1, tensor-model-parallel size: 2, pipeline-model-parallel size: 2 
setting global batch size to 1
using torch.float32 for parameters ...
------------------------ arguments ------------------------
  accumulate_allreduce_grads_in_fp32 .............. False
  adam_beta1 ...................................... 0.9
  adam_beta2 ...................................... 0.999
  adam_eps ........................................ 1e-08
  add_bias_linear ................................. False
  add_position_embedding .......................... False
  adlr_autoresume ................................. False
  adlr_autoresume_interval ........................ 1000
  apply_layernorm_1p .............................. False
  apply_query_key_layer_scaling ................... True
  apply_residual_connection_post_layernorm ........ False
  async_tensor_model_parallel_allreduce ........... False
  attention_dropout ............................... 0.1
  attention_softmax_in_fp32 ....................... False
  barrier_with_L1_time ............................ True
  bert_binary_head ................................ True
  bert_embedder_type .............................. megatron
  bert_load ....................................... None
  bf16 ............................................ False
  bias_dropout_fusion ............................. False
  bias_gelu_fusion ................................ False
  biencoder_projection_dim ........................ 0
  biencoder_shared_query_context_model ............ False
  block_data_path ................................. None
  check_for_nan_in_loss_and_grad .................. True
  classes_fraction ................................ 1.0
  clip_grad ....................................... 1.0
  consumed_train_samples .......................... 0
  consumed_train_tokens ........................... 0
  consumed_valid_samples .......................... 0
  data_cache_path ................................. None
  data_parallel_random_init ....................... False
  data_parallel_size .............................. 1
  data_path ....................................... None
  data_per_class_fraction ......................... 1.0
  data_sharding ................................... True
  dataloader_type ................................. single
  decoder_num_layers .............................. None
  decoder_seq_length .............................. None
  delay_grad_reduce ............................... True
  dino_bottleneck_size ............................ 256
  dino_freeze_last_layer .......................... 1
  dino_head_hidden_size ........................... 2048
  dino_local_crops_number ......................... 10
  dino_local_img_size ............................. 96
  dino_norm_last_layer ............................ False
  dino_teacher_temp ............................... 0.07
  dino_warmup_teacher_temp ........................ 0.04
  dino_warmup_teacher_temp_epochs ................. 30
  distribute_saved_activations .................... False
  distributed_backend ............................. nccl
  distributed_timeout_minutes ..................... 10
  embedding_path .................................. None
  empty_unused_memory_level ....................... 0
  encoder_num_layers .............................. 32
  encoder_seq_length .............................. 4096
  end_weight_decay ................................ 0.01
  eod_mask_loss ................................... False
  eval_interval ................................... 1000
  eval_iters ...................................... 100
  evidence_data_path .............................. None
  exit_duration_in_mins ........................... None
  exit_interval ................................... None
  exit_on_missing_checkpoint ...................... False
  exit_signal_handler ............................. False
  expert_parallel ................................. False
  ffn_hidden_size ................................. 11008
  finetune ........................................ False
  fp16 ............................................ False
  fp16_lm_cross_entropy ........................... False
  fp32_residual_connection ........................ False
  fp8 ............................................. None
  fp8_amax_compute_algo ........................... most_recent
  fp8_amax_history_len ............................ 1
  fp8_interval .................................... 1
  fp8_margin ...................................... 0
  fp8_wgrad ....................................... True
  global_batch_size ............................... 1
  gradient_accumulation_fusion .................... True
  group_query_attention ........................... True
  head_lr_mult .................................... 1.0
  hidden_dropout .................................. 0.1
  hidden_size ..................................... 4096
  hysteresis ...................................... 2
  ict_head_size ................................... None
  ict_load ........................................ None
  img_h ........................................... 224
  img_w ........................................... 224
  indexer_batch_size .............................. 128
  indexer_log_interval ............................ 1000
  inference_batch_times_seqlen_threshold .......... 512
  init_method_std ................................. 0.02
  init_method_xavier_uniform ...................... False
  initial_loss_scale .............................. 4294967296
  iter_per_epoch .................................. 1250
  iteration ....................................... 40000
  kv_channels ..................................... 128
  lazy_mpu_init ................................... None
  load ............................................ /groups/gaf51275/llama/checkpoints/Llama-2-7b-base-extended-scaling/okazaki_lab_cc//tp2-pp2
  local_rank ...................................... None
  log_batch_size_to_tensorboard ................... False
  log_interval .................................... 100
  log_learning_rate_to_tensorboard ................ True
  log_loss_scale_to_tensorboard ................... True
  log_memory_to_tensorboard ....................... False
  log_num_zeros_in_grad ........................... False
  log_params_norm ................................. False
  log_timers_to_tensorboard ....................... False
  log_validation_ppl_to_tensorboard ............... False
  log_world_size_to_tensorboard ................... False
  loss_scale ...................................... None
  loss_scale_window ............................... 1000
  lr .............................................. None
  lr_decay_iters .................................. None
  lr_decay_samples ................................ None
  lr_decay_style .................................. linear
  lr_warmup_fraction .............................. None
  lr_warmup_init .................................. 0.0
  lr_warmup_iters ................................. 0
  lr_warmup_samples ............................... 0
  make_vocab_size_divisible_by .................... 128
  mask_factor ..................................... 1.0
  mask_prob ....................................... 0.15
  mask_type ....................................... random
  masked_softmax_fusion ........................... False
  max_position_embeddings ......................... 4096
  max_tokens_to_oom ............................... 12000
  merge_file ...................................... None
  micro_batch_size ................................ 1
  min_loss_scale .................................. 1.0
  min_lr .......................................... 0.0
  mmap_warmup ..................................... False
  model_spec ...................................... None
  no_load_optim ................................... True
  no_load_rng ..................................... True
  no_persist_layer_norm ........................... False
  no_save_optim ................................... True
  no_save_rng ..................................... True
  norm_epsilon .................................... 1e-05
  normalization ................................... RMSNorm
  num_attention_heads ............................. 32
  num_channels .................................... 3
  num_classes ..................................... 1000
  num_experts ..................................... None
  num_layers ...................................... 32
  num_layers_per_virtual_pipeline_stage ........... None
  num_query_groups ................................ 32
  num_workers ..................................... 2
  onnx_safe ....................................... None
  openai_gelu ..................................... False
  optimizer ....................................... adam
  output_bert_embeddings .......................... False
  overlap_grad_reduce ............................. False
  overlap_p2p_comm ................................ False
  override_opt_param_scheduler .................... False
  padded_vocab_size ............................... 43176
  params_dtype .................................... torch.float32
  patch_dim ....................................... 16
  perform_initialization .......................... False
  pipeline_model_parallel_size .................... 2
  pipeline_model_parallel_split_rank .............. None
  position_embedding_type ......................... rope
  profile ......................................... False
  profile_ranks ................................... [0]
  profile_step_end ................................ 12
  profile_step_start .............................. 10
  query_in_block_prob ............................. 0.1
  rampup_batch_size ............................... None
  rank ............................................ 0
  recompute_granularity ........................... None
  recompute_method ................................ None
  recompute_num_layers ............................ None
  reset_attention_mask ............................ False
  reset_position_ids .............................. False
  retriever_report_topk_accuracies ................ []
  retriever_score_scaling ......................... False
  retriever_seq_length ............................ 256
  retro_add_retriever ............................. False
  retro_cyclic_train_iters ........................ None
  retro_encoder_attention_dropout ................. 0.1
  retro_encoder_hidden_dropout .................... 0.1
  retro_encoder_layers ............................ 2
  retro_num_neighbors ............................. 2
  retro_num_retrieved_chunks ...................... 2
  retro_return_doc_ids ............................ False
  retro_workdir ................................... None
  rotary_percent .................................. 1.0
  rotary_seq_len_interpolation_factor ............. None
  sample_rate ..................................... 1.0
  save ............................................ None
  save_interval ................................... None
  scatter_gather_tensors_in_pipeline .............. True
  seed ............................................ 1234
  seq_length ...................................... 4096
  sequence_parallel ............................... False
  sgd_momentum .................................... 0.9
  short_seq_prob .................................. 0.1
  skip_train ...................................... False
  skip_train_iteration_range ...................... None
  split ........................................... 969, 30, 1
  squared_relu .................................... False
  standalone_embedding_stage ...................... False
  start_weight_decay .............................. 0.01
  swiglu .......................................... True
  swin_backbone_type .............................. tiny
  tensor_model_parallel_size ...................... 2
  tensorboard_dir ................................. None
  tensorboard_log_interval ........................ 1
  tensorboard_queue_size .......................... 1000
  test_data_path .................................. None
  timing_log_level ................................ 0
  timing_log_option ............................... minmax
  titles_data_path ................................ None
  tokenizer_model ................................. None
  tokenizer_type .................................. Llama2Tokenizer
  train_data_path ................................. None
  train_iters ..................................... None
  train_samples ................................... None
  transformer_impl ................................ local
  transformer_pipeline_model_parallel_size ........ 2
  untie_embeddings_and_output_weights ............. True
  use_checkpoint_args ............................. False
  use_checkpoint_opt_param_scheduler .............. False
  use_cpu_initialization .......................... True
  use_distributed_optimizer ....................... False
  use_flash_attn .................................. False
  use_mpi ......................................... False
  use_one_sent_docs ............................... False
  use_ring_exchange_p2p ........................... False
  use_rotary_position_embeddings .................. True
  use_z_loss ...................................... False
  valid_data_path ................................. None
  variable_seq_lengths ............................ False
  virtual_pipeline_model_parallel_size ............ None
  vision_backbone_type ............................ vit
  vision_pretraining .............................. False
  vision_pretraining_type ......................... classify
  vocab_extra_ids ................................. 0
  vocab_file ...................................... None
  vocab_size ...................................... None
  wandb_entity .................................... None
  wandb_id ........................................ None
  wandb_name ...................................... None
  wandb_project ................................... None
  weight_decay .................................... 0.01
  weight_decay_incr_style ......................... constant
  world_size ...................................... 4
-------------------- end of arguments ---------------------
setting number of micro-batches to constant 1
building GPT model ...
 loading checkpoint from /groups/gaf51275/llama/checkpoints/Llama-2-7b-base-extended-scaling/okazaki_lab_cc//tp2-pp2 at iteration 40000
 checkpoint version 3.0
  successfully loaded checkpoint from /groups/gaf51275/llama/checkpoints/Llama-2-7b-base-extended-scaling/okazaki_lab_cc//tp2-pp2 at iteration 40000
building GPT model ...
 loading checkpoint from /groups/gaf51275/llama/checkpoints/Llama-2-7b-base-extended-scaling/okazaki_lab_cc//tp2-pp2 at iteration 40000
 checkpoint version 3.0
  successfully loaded checkpoint from /groups/gaf51275/llama/checkpoints/Llama-2-7b-base-extended-scaling/okazaki_lab_cc//tp2-pp2 at iteration 40000
Overwriting default ffn_hidden_size value None with value from checkpoint 11008.
Overwriting default kv_channels value None with value from checkpoint 128.
Overwriting default group_query_attention value False with value from checkpoint True.
Overwriting default num_query_groups value 1 with value from checkpoint 32.
Overwriting default use_rotary_position_embeddings value False with value from checkpoint True.
Overwriting default add_position_embedding value True with value from checkpoint False.
Overwriting default normalization value LayerNorm with value from checkpoint RMSNorm.
Overwriting default swiglu value False with value from checkpoint True.
Overwriting default attention_dropout value 0.1 with value from checkpoint 0.0.
Overwriting default hidden_dropout value 0.1 with value from checkpoint 0.0.
Overwriting default weight_decay value 0.01 with value from checkpoint 0.1.
Overwriting default adam_beta2 value 0.999 with value from checkpoint 0.95.
Overwriting default global_batch_size value None with value from checkpoint 1024.
Overwriting default wandb_entity value None with value from checkpoint prj-jalm.
Overwriting default wandb_name value None with value from checkpoint llama-2-7b-base-extended-okazaki-lab-cc-a100-4node-32gpu-4096s-DP=8-TP=2-PP=2-BS=1024-LR=1e-4-MINLR=3.3e-6-WARMUP=1000-WD=0.1-GC=1.
Overwriting default wandb_project value None with value from checkpoint Llama-2-7B.
Overwriting default use_mpi value False with value from checkpoint True.
Overwriting default log_interval value 100 with value from checkpoint 1.
Overwriting default use_flash_attn value False with value from checkpoint True.
Overwriting default dataloader_type value None with value from checkpoint single.
Overwriting default lr value None with value from checkpoint 0.0001.
Overwriting default lr_decay_style value linear with value from checkpoint cosine.
Overwriting default min_lr value 0.0 with value from checkpoint 3.3e-06.
Overwriting default load value None with value from checkpoint /groups/gaf51275/llama/checkpoints/Llama-2-7b-base-extended-scaling/okazaki_lab_cc/tp2-pp2.
Overwriting default use_checkpoint_args value False with value from checkpoint True.
Overwriting default bf16 value False with value from checkpoint True.
Overwriting default apply_query_key_layer_scaling value True with value from checkpoint False.
Overwriting default accumulate_allreduce_grads_in_fp32 value False with value from checkpoint True.
Overwriting default local_rank value None with value from checkpoint 0.
Overwriting default use_distributed_optimizer value False with value from checkpoint True.
Overwriting default eval_iters value 100 with value from checkpoint 10.
Overwriting default eval_interval value 1000 with value from checkpoint 100.
Overwriting default data_path value None with value from checkpoint ['9344955862', '/bb/llm/gaf51275/llama/datasets/okazaki_lab_cc_2100_okazaki_lab_cc_nfkc_16k_aligned_8/merged_0_text_document', '9387405706', '/bb/llm/gaf51275/llama/datasets/okazaki_lab_cc_2100_okazaki_lab_cc_nfkc_16k_aligned_8/merged_1_text_document', '10614722501', '/bb/llm/gaf51275/llama/datasets/okazaki_lab_cc_2100_okazaki_lab_cc_nfkc_16k_aligned_8/merged_2_text_document', '10774826633', '/bb/llm/gaf51275/llama/datasets/okazaki_lab_cc_2100_okazaki_lab_cc_nfkc_16k_aligned_8/merged_3_text_document', '10525668913', '/bb/llm/gaf51275/llama/datasets/okazaki_lab_cc_2100_okazaki_lab_cc_nfkc_16k_aligned_8/merged_4_text_document', '9502019045', '/bb/llm/gaf51275/llama/datasets/okazaki_lab_cc_2100_okazaki_lab_cc_nfkc_16k_aligned_8/merged_5_text_document', '8784459147', '/bb/llm/gaf51275/llama/datasets/okazaki_lab_cc_2100_okazaki_lab_cc_nfkc_16k_aligned_8/merged_6_text_document', '9826112028', '/bb/llm/gaf51275/llama/datasets/okazaki_lab_cc_2100_okazaki_lab_cc_nfkc_16k_aligned_8/merged_7_text_document', '9152375731', '/bb/llm/gaf51275/llama/datasets/okazaki_lab_cc_2100_okazaki_lab_cc_nfkc_16k_aligned_8/merged_8_text_document', '9891239743', '/bb/llm/gaf51275/llama/datasets/okazaki_lab_cc_2100_okazaki_lab_cc_nfkc_16k_aligned_8/merged_9_text_document', '9341639254', '/bb/llm/gaf51275/llama/datasets/okazaki_lab_cc_2100_okazaki_lab_cc_nfkc_16k_aligned_8/merged_10_text_document', '9702056537', '/bb/llm/gaf51275/llama/datasets/okazaki_lab_cc_2100_okazaki_lab_cc_nfkc_16k_aligned_8/merged_11_text_document', '9047625381', '/bb/llm/gaf51275/llama/datasets/okazaki_lab_cc_2100_okazaki_lab_cc_nfkc_16k_aligned_8/merged_12_text_document', '9059299870', '/bb/llm/gaf51275/llama/datasets/okazaki_lab_cc_2100_okazaki_lab_cc_nfkc_16k_aligned_8/merged_13_text_document', '8623585025', '/bb/llm/gaf51275/llama/datasets/okazaki_lab_cc_2100_okazaki_lab_cc_nfkc_16k_aligned_8/merged_14_text_document', '11360430162', '/bb/llm/gaf51275/llama/datasets/okazaki_lab_cc_2100_okazaki_lab_cc_nfkc_16k_aligned_8/merged_15_text_document', '10562828472', '/bb/llm/gaf51275/llama/datasets/okazaki_lab_cc_2100_okazaki_lab_cc_nfkc_16k_aligned_8/merged_16_text_document', '9116094403', '/bb/llm/gaf51275/llama/datasets/okazaki_lab_cc_2100_okazaki_lab_cc_nfkc_16k_aligned_8/merged_17_text_document', '9932843686', '/bb/llm/gaf51275/llama/datasets/okazaki_lab_cc_2100_okazaki_lab_cc_nfkc_16k_aligned_8/merged_18_text_document', '11097404819', '/bb/llm/gaf51275/llama/datasets/okazaki_lab_cc_2100_okazaki_lab_cc_nfkc_16k_aligned_8/merged_19_text_document', '9224853685', '/bb/llm/gaf51275/llama/datasets/okazaki_lab_cc_2100_okazaki_lab_cc_nfkc_16k_aligned_8/merged_20_text_document', '1672543873', '/bb/llm/gaf51275/llama/datasets/okazaki_lab_cc_2100_okazaki_lab_cc_nfkc_16k_aligned_8/ja_wiki_merged_train_text_document', '11474721693', '/bb/llm/gaf51275/llama/datasets/okazaki_lab_cc_2100_okazaki_lab_cc_nfkc_16k_aligned_8/lumi_en_arxiv_merged_text_document', '11474721693', '/bb/llm/gaf51275/llama/datasets/okazaki_lab_cc_2100_okazaki_lab_cc_nfkc_16k_aligned_8/lumi_en_falcon_merged_threadripper-3960x_8_text_document'].
Overwriting default split value 969, 30, 1 with value from checkpoint 949,50,1.
Checkpoint had argument iteration but new arguments does not have this.
Checkpoint had argument padded_vocab_size but new arguments does not have this.
Checkpoint had argument transformer_pipeline_model_parallel_size but new arguments does not have this.
Checkpoint had argument data_parallel_size but new arguments does not have this.
Checkpoint had argument consumed_train_samples but new arguments does not have this.
Checkpoint had argument consumed_valid_samples but new arguments does not have this.
Checkpoint had argument consumed_train_tokens but new arguments does not have this.
Checkpoint had argument variable_seq_lengths but new arguments does not have this.
Checkpoint had argument model_type but new arguments does not have this.
Checkpoint had argument allow_transformer_engine but new arguments does not have this.
Checkpoint had argument do_train but new arguments does not have this.
Checkpoint had argument do_valid but new arguments does not have this.
Checkpoint had argument do_test but new arguments does not have this.
Checkpoint had argument curr_iteration but new arguments does not have this.
using world size: 1, data-parallel-size: 1, tensor-model-parallel size: 1, pipeline-model-parallel size: 1 
using torch.bfloat16 for parameters ...
------------------------ arguments ------------------------
  accumulate_allreduce_grads_in_fp32 .............. True
  adam_beta1 ...................................... 0.9
  adam_beta2 ...................................... 0.95
  adam_eps ........................................ 1e-08
  add_bias_linear ................................. False
  add_position_embedding .......................... False
  adlr_autoresume ................................. False
  adlr_autoresume_interval ........................ 1000
  apply_layernorm_1p .............................. False
  apply_query_key_layer_scaling ................... False
  apply_residual_connection_post_layernorm ........ False
  async_tensor_model_parallel_allreduce ........... False
  attention_dropout ............................... 0.0
  attention_softmax_in_fp32 ....................... False
  barrier_with_L1_time ............................ True
  bert_binary_head ................................ True
  bert_embedder_type .............................. megatron
  bert_load ....................................... None
  bf16 ............................................ True
  bias_dropout_fusion ............................. False
  bias_gelu_fusion ................................ False
  biencoder_projection_dim ........................ 0
  biencoder_shared_query_context_model ............ False
  block_data_path ................................. None
  check_for_nan_in_loss_and_grad .................. True
  classes_fraction ................................ 1.0
  clip_grad ....................................... 1.0
  consumed_train_samples .......................... 0
  consumed_train_tokens ........................... 0
  consumed_valid_samples .......................... 0
  data_cache_path ................................. None
  data_parallel_random_init ....................... False
  data_parallel_size .............................. 1
  data_path ....................................... ['9344955862', '/bb/llm/gaf51275/llama/datasets/okazaki_lab_cc_2100_okazaki_lab_cc_nfkc_16k_aligned_8/merged_0_text_document', '9387405706', '/bb/llm/gaf51275/llama/datasets/okazaki_lab_cc_2100_okazaki_lab_cc_nfkc_16k_aligned_8/merged_1_text_document', '10614722501', '/bb/llm/gaf51275/llama/datasets/okazaki_lab_cc_2100_okazaki_lab_cc_nfkc_16k_aligned_8/merged_2_text_document', '10774826633', '/bb/llm/gaf51275/llama/datasets/okazaki_lab_cc_2100_okazaki_lab_cc_nfkc_16k_aligned_8/merged_3_text_document', '10525668913', '/bb/llm/gaf51275/llama/datasets/okazaki_lab_cc_2100_okazaki_lab_cc_nfkc_16k_aligned_8/merged_4_text_document', '9502019045', '/bb/llm/gaf51275/llama/datasets/okazaki_lab_cc_2100_okazaki_lab_cc_nfkc_16k_aligned_8/merged_5_text_document', '8784459147', '/bb/llm/gaf51275/llama/datasets/okazaki_lab_cc_2100_okazaki_lab_cc_nfkc_16k_aligned_8/merged_6_text_document', '9826112028', '/bb/llm/gaf51275/llama/datasets/okazaki_lab_cc_2100_okazaki_lab_cc_nfkc_16k_aligned_8/merged_7_text_document', '9152375731', '/bb/llm/gaf51275/llama/datasets/okazaki_lab_cc_2100_okazaki_lab_cc_nfkc_16k_aligned_8/merged_8_text_document', '9891239743', '/bb/llm/gaf51275/llama/datasets/okazaki_lab_cc_2100_okazaki_lab_cc_nfkc_16k_aligned_8/merged_9_text_document', '9341639254', '/bb/llm/gaf51275/llama/datasets/okazaki_lab_cc_2100_okazaki_lab_cc_nfkc_16k_aligned_8/merged_10_text_document', '9702056537', '/bb/llm/gaf51275/llama/datasets/okazaki_lab_cc_2100_okazaki_lab_cc_nfkc_16k_aligned_8/merged_11_text_document', '9047625381', '/bb/llm/gaf51275/llama/datasets/okazaki_lab_cc_2100_okazaki_lab_cc_nfkc_16k_aligned_8/merged_12_text_document', '9059299870', '/bb/llm/gaf51275/llama/datasets/okazaki_lab_cc_2100_okazaki_lab_cc_nfkc_16k_aligned_8/merged_13_text_document', '8623585025', '/bb/llm/gaf51275/llama/datasets/okazaki_lab_cc_2100_okazaki_lab_cc_nfkc_16k_aligned_8/merged_14_text_document', '11360430162', '/bb/llm/gaf51275/llama/datasets/okazaki_lab_cc_2100_okazaki_lab_cc_nfkc_16k_aligned_8/merged_15_text_document', '10562828472', '/bb/llm/gaf51275/llama/datasets/okazaki_lab_cc_2100_okazaki_lab_cc_nfkc_16k_aligned_8/merged_16_text_document', '9116094403', '/bb/llm/gaf51275/llama/datasets/okazaki_lab_cc_2100_okazaki_lab_cc_nfkc_16k_aligned_8/merged_17_text_document', '9932843686', '/bb/llm/gaf51275/llama/datasets/okazaki_lab_cc_2100_okazaki_lab_cc_nfkc_16k_aligned_8/merged_18_text_document', '11097404819', '/bb/llm/gaf51275/llama/datasets/okazaki_lab_cc_2100_okazaki_lab_cc_nfkc_16k_aligned_8/merged_19_text_document', '9224853685', '/bb/llm/gaf51275/llama/datasets/okazaki_lab_cc_2100_okazaki_lab_cc_nfkc_16k_aligned_8/merged_20_text_document', '1672543873', '/bb/llm/gaf51275/llama/datasets/okazaki_lab_cc_2100_okazaki_lab_cc_nfkc_16k_aligned_8/ja_wiki_merged_train_text_document', '11474721693', '/bb/llm/gaf51275/llama/datasets/okazaki_lab_cc_2100_okazaki_lab_cc_nfkc_16k_aligned_8/lumi_en_arxiv_merged_text_document', '11474721693', '/bb/llm/gaf51275/llama/datasets/okazaki_lab_cc_2100_okazaki_lab_cc_nfkc_16k_aligned_8/lumi_en_falcon_merged_threadripper-3960x_8_text_document']
  data_per_class_fraction ......................... 1.0
  data_sharding ................................... True
  dataloader_type ................................. single
  decoder_num_layers .............................. None
  decoder_seq_length .............................. None
  delay_grad_reduce ............................... True
  dino_bottleneck_size ............................ 256
  dino_freeze_last_layer .......................... 1
  dino_head_hidden_size ........................... 2048
  dino_local_crops_number ......................... 10
  dino_local_img_size ............................. 96
  dino_norm_last_layer ............................ False
  dino_teacher_temp ............................... 0.07
  dino_warmup_teacher_temp ........................ 0.04
  dino_warmup_teacher_temp_epochs ................. 30
  distribute_saved_activations .................... False
  distributed_backend ............................. nccl
  distributed_timeout_minutes ..................... 10
  embedding_path .................................. None
  empty_unused_memory_level ....................... 0
  encoder_num_layers .............................. 32
  encoder_seq_length .............................. 4096
  end_weight_decay ................................ 0.1
  eod_mask_loss ................................... False
  eval_interval ................................... 100
  eval_iters ...................................... 10
  evidence_data_path .............................. None
  exit_duration_in_mins ........................... None
  exit_interval ................................... None
  exit_on_missing_checkpoint ...................... False
  exit_signal_handler ............................. False
  expert_parallel ................................. False
  ffn_hidden_size ................................. 11008
  finetune ........................................ False
  fp16 ............................................ False
  fp16_lm_cross_entropy ........................... False
  fp32_residual_connection ........................ False
  fp8 ............................................. None
  fp8_amax_compute_algo ........................... most_recent
  fp8_amax_history_len ............................ 1
  fp8_interval .................................... 1
  fp8_margin ...................................... 0
  fp8_wgrad ....................................... True
  global_batch_size ............................... 1024
  gradient_accumulation_fusion .................... True
  group_query_attention ........................... True
  head_lr_mult .................................... 1.0
  hidden_dropout .................................. 0.0
  hidden_size ..................................... 4096
  hysteresis ...................................... 2
  ict_head_size ................................... None
  ict_load ........................................ None
  img_h ........................................... 224
  img_w ........................................... 224
  indexer_batch_size .............................. 128
  indexer_log_interval ............................ 1000
  inference_batch_times_seqlen_threshold .......... 512
  init_method_std ................................. 0.02
  init_method_xavier_uniform ...................... False
  initial_loss_scale .............................. 4294967296
  iter_per_epoch .................................. 1250
  kv_channels ..................................... 128
  lazy_mpu_init ................................... None
  load ............................................ /groups/gaf51275/llama/checkpoints/Llama-2-7b-base-extended-scaling/okazaki_lab_cc/tp2-pp2
  local_rank ...................................... 0
  log_batch_size_to_tensorboard ................... False
  log_interval .................................... 1
  log_learning_rate_to_tensorboard ................ True
  log_loss_scale_to_tensorboard ................... True
  log_memory_to_tensorboard ....................... False
  log_num_zeros_in_grad ........................... False
  log_params_norm ................................. False
  log_timers_to_tensorboard ....................... False
  log_validation_ppl_to_tensorboard ............... False
  log_world_size_to_tensorboard ................... False
  loss_scale ...................................... None
  loss_scale_window ............................... 1000
  lr .............................................. 0.0001
  lr_decay_iters .................................. None
  lr_decay_samples ................................ None
  lr_decay_style .................................. cosine
  lr_warmup_fraction .............................. None
  lr_warmup_init .................................. 0.0
  lr_warmup_iters ................................. 0
  lr_warmup_samples ............................... 0
  make_vocab_size_divisible_by .................... 128
  mask_factor ..................................... 1.0
  mask_prob ....................................... 0.15
  mask_type ....................................... random
  masked_softmax_fusion ........................... False
  max_position_embeddings ......................... 4096
  max_tokens_to_oom ............................... 12000
  merge_file ...................................... None
  micro_batch_size ................................ 1
  min_loss_scale .................................. 1.0
  min_lr .......................................... 3.3e-06
  mmap_warmup ..................................... False
  model_spec ...................................... None
  no_load_optim ................................... True
  no_load_rng ..................................... True
  no_persist_layer_norm ........................... False
  no_save_optim ................................... True
  no_save_rng ..................................... True
  norm_epsilon .................................... 1e-05
  normalization ................................... RMSNorm
  num_attention_heads ............................. 32
  num_channels .................................... 3
  num_classes ..................................... 1000
  num_experts ..................................... None
  num_layers ...................................... 32
  num_layers_per_virtual_pipeline_stage ........... None
  num_query_groups ................................ 32
  num_workers ..................................... 2
  onnx_safe ....................................... None
  openai_gelu ..................................... False
  optimizer ....................................... adam
  output_bert_embeddings .......................... False
  overlap_grad_reduce ............................. False
  overlap_p2p_comm ................................ False
  override_opt_param_scheduler .................... False
  params_dtype .................................... torch.bfloat16
  patch_dim ....................................... 16
  perform_initialization .......................... False
  pipeline_model_parallel_size .................... 1
  pipeline_model_parallel_split_rank .............. None
  position_embedding_type ......................... rope
  profile ......................................... False
  profile_ranks ................................... [0]
  profile_step_end ................................ 12
  profile_step_start .............................. 10
  query_in_block_prob ............................. 0.1
  rampup_batch_size ............................... None
  rank ............................................ 0
  recompute_granularity ........................... None
  recompute_method ................................ None
  recompute_num_layers ............................ None
  reset_attention_mask ............................ False
  reset_position_ids .............................. False
  retriever_report_topk_accuracies ................ []
  retriever_score_scaling ......................... False
  retriever_seq_length ............................ 256
  retro_add_retriever ............................. False
  retro_cyclic_train_iters ........................ None
  retro_encoder_attention_dropout ................. 0.1
  retro_encoder_hidden_dropout .................... 0.1
  retro_encoder_layers ............................ 2
  retro_num_neighbors ............................. 2
  retro_num_retrieved_chunks ...................... 2
  retro_return_doc_ids ............................ False
  retro_workdir ................................... None
  rotary_percent .................................. 1.0
  rotary_seq_len_interpolation_factor ............. None
  sample_rate ..................................... 1.0
  save ............................................ /bb/llm/gaf51275/llama/from_megatron_hf_checkpoints/megatron_checkpoints/Llama2-7b-base-extended-scaling/okazaki_lab_cc/tp1-pp1
  save_interval ................................... 1
  scatter_gather_tensors_in_pipeline .............. True
  seed ............................................ 1234
  seq_length ...................................... 4096
  sequence_parallel ............................... False
  sgd_momentum .................................... 0.9
  short_seq_prob .................................. 0.1
  skip_train ...................................... False
  skip_train_iteration_range ...................... None
  split ........................................... 949,50,1
  squared_relu .................................... False
  standalone_embedding_stage ...................... False
  start_weight_decay .............................. 0.1
  swiglu .......................................... True
  swin_backbone_type .............................. tiny
  tensor_model_parallel_size ...................... 1
  tensorboard_dir ................................. None
  tensorboard_log_interval ........................ 1
  tensorboard_queue_size .......................... 1000
  test_data_path .................................. None
  timing_log_level ................................ 0
  timing_log_option ............................... minmax
  titles_data_path ................................ None
  tokenizer_model ................................. None
  tokenizer_type .................................. Llama2Tokenizer
  train_data_path ................................. None
  train_iters ..................................... None
  train_samples ................................... None
  transformer_impl ................................ local
  transformer_pipeline_model_parallel_size ........ 1
  untie_embeddings_and_output_weights ............. True
  use_checkpoint_args ............................. True
  use_checkpoint_opt_param_scheduler .............. False
  use_cpu_initialization .......................... True
  use_distributed_optimizer ....................... True
  use_flash_attn .................................. True
  use_mpi ......................................... True
  use_one_sent_docs ............................... False
  use_ring_exchange_p2p ........................... False
  use_rotary_position_embeddings .................. True
  use_z_loss ...................................... False
  valid_data_path ................................. None
  variable_seq_lengths ............................ False
  virtual_pipeline_model_parallel_size ............ None
  vision_backbone_type ............................ vit
  vision_pretraining .............................. False
  vision_pretraining_type ......................... classify
  vocab_extra_ids ................................. 0
  vocab_file ...................................... None
  vocab_size ...................................... None
  wandb_entity .................................... prj-jalm
  wandb_id ........................................ None
  wandb_name ...................................... llama-2-7b-base-extended-okazaki-lab-cc-a100-4node-32gpu-4096s-DP=8-TP=2-PP=2-BS=1024-LR=1e-4-MINLR=3.3e-6-WARMUP=1000-WD=0.1-GC=1
  wandb_project ................................... Llama-2-7B
  weight_decay .................................... 0.1
  weight_decay_incr_style ......................... constant
  world_size ...................................... 1
-------------------- end of arguments ---------------------
setting number of micro-batches to constant 1024
sending embeddings
sending transformer layer 0
sending transformer layer 1
sending transformer layer 2
sending transformer layer 3
sending transformer layer 4
sending transformer layer 5
sending transformer layer 6
sending transformer layer 7
sending transformer layer 8
sending transformer layer 9
sending transformer layer 10
sending transformer layer 11
sending transformer layer 12
sending transformer layer 13
sending transformer layer 14
sending transformer layer 15
building GPT model ...
 loading checkpoint from /groups/gaf51275/llama/checkpoints/Llama-2-7b-base-extended-scaling/okazaki_lab_cc//tp2-pp2 at iteration 40000
wandb: Currently logged in as: okoge (prj-jalm). Use `wandb login --relogin` to force relogin
wandb: wandb version 0.16.2 is available!  To upgrade, please run:
wandb:  $ pip install wandb --upgrade
wandb: Tracking run with wandb version 0.15.12
wandb: Run data is saved locally in /bb/1/llm/gaf51275/llama/Megatron-LM/wandb/run-20240130_154400-ertrvfpw
wandb: Run `wandb offline` to turn off syncing.
wandb: Syncing run llama-2-7b-base-extended-okazaki-lab-cc-a100-4node-32gpu-4096s-DP=8-TP=2-PP=2-BS=1024-LR=1e-4-MINLR=3.3e-6-WARMUP=1000-WD=0.1-GC=1-2024-01-30-15-43-59
wandb: ⭐️ View project at https://wandb.ai/prj-jalm/Llama-2-7B
wandb: 🚀 View run at https://wandb.ai/prj-jalm/Llama-2-7B/runs/ertrvfpw
> wandb ...
Setting consumed_train_samples to 40960000 and consumed_valid_samples to 4096000
received embeddings
Original vocab size not specified, leaving embedding table as-is. If you've changed the tensor parallel size this could cause problems.
building GPT model ...
 checkpoint version 3.0
  successfully loaded checkpoint from /groups/gaf51275/llama/checkpoints/Llama-2-7b-base-extended-scaling/okazaki_lab_cc//tp2-pp2 at iteration 40000
building GPT model ...
 loading checkpoint from /groups/gaf51275/llama/checkpoints/Llama-2-7b-base-extended-scaling/okazaki_lab_cc//tp2-pp2 at iteration 40000
 checkpoint version 3.0
  successfully loaded checkpoint from /groups/gaf51275/llama/checkpoints/Llama-2-7b-base-extended-scaling/okazaki_lab_cc//tp2-pp2 at iteration 40000
received transformer layer 0
received transformer layer 1
received transformer layer 2
received transformer layer 3
received transformer layer 4
received transformer layer 5
received transformer layer 6
received transformer layer 7
received transformer layer 8
received transformer layer 9
received transformer layer 10
received transformer layer 11
received transformer layer 12
received transformer layer 13
received transformer layer 14
received transformer layer 15
received transformer layer 16
received transformer layer 17
received transformer layer 18
received transformer layer 19
received transformer layer 20
received transformer layer 21
received transformer layer 22
received transformer layer 23
received transformer layer 24
received transformer layer 25
received transformer layer 26
received transformer layer 27
received transformer layer 28
received transformer layer 29
received transformer layer 30
received transformer layer 31
received final norm
received output layer
saving checkpoint at iteration   40000 to /bb/llm/gaf51275/llama/from_megatron_hf_checkpoints/megatron_checkpoints/Llama2-7b-base-extended-scaling/okazaki_lab_cc/tp1-pp1
  successfully saved checkpoint at iteration   40000 to /bb/llm/gaf51275/llama/from_megatron_hf_checkpoints/megatron_checkpoints/Llama2-7b-base-extended-scaling/okazaki_lab_cc/tp1-pp1
Done!
sending transformer layer 16
sending transformer layer 17
sending transformer layer 18
sending transformer layer 19
sending transformer layer 20
sending transformer layer 21
sending transformer layer 22
sending transformer layer 23
sending transformer layer 24
sending transformer layer 25
sending transformer layer 26
sending transformer layer 27
sending transformer layer 28
sending transformer layer 29
sending transformer layer 30
sending transformer layer 31
sending final norm
sending output layer
Waiting for saver to complete...
